{"hourly_first_year":2017,"hourly":[{"system_id":"mtl-bixi","hour":0,"departures":1495921,"returns":1645812},{"system_id":"mtl-bixi","hour":1,"departures":991466,"returns":1070946},{"system_id":"mtl-bixi","hour":2,"departures":650389,"returns":716006},{"system_id":"mtl-bixi","hour":3,"departures":501175,"returns":547669},{"system_id":"mtl-bixi","hour":4,"departures":255968,"returns":299341},{"system_id":"mtl-bixi","hour":5,"departures":344194,"returns":310729},{"system_id":"mtl-bixi","hour":6,"departures":912189,"returns":767554},{"system_id":"mtl-bixi","hour":7,"departures":2534991,"returns":2049493},{"system_id":"mtl-bixi","hour":8,"departures":4510133,"returns":4381049},{"system_id":"mtl-bixi","hour":9,"departures":3105794,"returns":3383622},{"system_id":"mtl-bixi","hour":10,"departures":2763945,"returns":2696250},{"system_id":"mtl-bixi","hour":11,"departures":3428655,"returns":3215258},{"system_id":"mtl-bixi","hour":12,"departures":4123091,"returns":4008342},{"system_id":"mtl-bixi","hour":13,"departures":4230806,"returns":4204733},{"system_id":"mtl-bixi","hour":14,"departures":4332405,"returns":4235551},{"system_id":"mtl-bixi","hour":15,"departures":5013137,"returns":4829682},{"system_id":"mtl-bixi","hour":16,"departures":6338864,"returns":5987172},{"system_id":"mtl-bixi","hour":17,"departures":7762603,"returns":7664921},{"system_id":"mtl-bixi","hour":18,"departures":6462228,"returns":6789193},{"system_id":"mtl-bixi","hour":19,"departures":5115586,"returns":5406365},{"system_id":"mtl-bixi","hour":20,"departures":4111947,"returns":4312496},{"system_id":"mtl-bixi","hour":21,"departures":3394418,"returns":3567289},{"system_id":"mtl-bixi","hour":22,"departures":2751221,"returns":2872965},{"system_id":"mtl-bixi","hour":23,"departures":2214378,"returns":2383066},{"system_id":"tor-bikeshare","hour":0,"departures":514356,"returns":586037},{"system_id":"tor-bikeshare","hour":1,"departures":324725,"returns":360570},{"system_id":"tor-bikeshare","hour":2,"departures":236468,"returns":255350},{"system_id":"tor-bikeshare","hour":3,"departures":125409,"returns":153647},{"system_id":"tor-bikeshare","hour":4,"departures":92024,"returns":95206},{"system_id":"tor-bikeshare","hour":5,"departures":183147,"returns":159044},{"system_id":"tor-bikeshare","hour":6,"departures":517669,"returns":438494},{"system_id":"tor-bikeshare","hour":7,"departures":1161749,"returns":980713},{"system_id":"tor-bikeshare","hour":8,"departures":2384425,"returns":2171904},{"system_id":"tor-bikeshare","hour":9,"departures":1755569,"returns":1959876},{"system_id":"tor-bikeshare","hour":10,"departures":1434122,"returns":1401808},{"system_id":"tor-bikeshare","hour":11,"departures":1682218,"returns":1572355},{"system_id":"tor-bikeshare","hour":12,"departures":2019425,"returns":1939773},{"system_id":"tor-bikeshare","hour":13,"departures":2117305,"returns":2075166},{"system_id":"tor-bikeshare","hour":14,"departures":2201809,"returns":2137560},{"system_id":"tor-bikeshare","hour":15,"departures":2476945,"returns":2398288},{"system_id":"tor-bikeshare","hour":16,"departures":3120185,"returns":2930346},{"system_id":"tor-bikeshare","hour":17,"departures":4010428,"returns":3906900},{"system_id":"tor-bikeshare","hour":18,"departures":3431413,"returns":3584931},{"system_id":"tor-bikeshare","hour":19,"departures":2672794,"returns":2853453},{"system_id":"tor-bikeshare","hour":20,"departures":2004997,"returns":2181994},{"system_id":"tor-bikeshare","hour":21,"departures":1509530,"returns":1650017},{"system_id":"tor-bikeshare","hour":22,"departures":1141826,"returns":1237264},{"system_id":"tor-bikeshare","hour":23,"departures":851324,"returns":939166},{"system_id":"van-mobi","hour":0,"departures":93160,"returns":106380},{"system_id":"van-mobi","hour":1,"departures":51256,"returns":59768},{"system_id":"van-mobi","hour":2,"departures":28976,"returns":32928},{"system_id":"van-mobi","hour":3,"departures":18161,"returns":20963},{"system_id":"van-mobi","hour":4,"departures":13216,"returns":13620},{"system_id":"van-mobi","hour":5,"departures":20448,"returns":17648},{"system_id":"van-mobi","hour":6,"departures":68073,"returns":56131},{"system_id":"van-mobi","hour":7,"departures":166620,"returns":143681},{"system_id":"van-mobi","hour":8,"departures":397768,"returns":349928},{"system_id":"van-mobi","hour":9,"departures":471767,"returns":477041},{"system_id":"van-mobi","hour":10,"departures":373805,"returns":355384},{"system_id":"van-mobi","hour":11,"departures":420161,"returns":377575},{"system_id":"van-mobi","hour":12,"departures":526123,"returns":485594},{"system_id":"van-mobi","hour":13,"departures":580710,"returns":559695},{"system_id":"van-mobi","hour":14,"departures":605111,"returns":588951},{"system_id":"van-mobi","hour":15,"departures":664554,"returns":640827},{"system_id":"van-mobi","hour":16,"departures":758136,"returns":743980},{"system_id":"van-mobi","hour":17,"departures":907657,"returns":892679},{"system_id":"van-mobi","hour":18,"departures":832550,"returns":881775},{"system_id":"van-mobi","hour":19,"departures":626959,"returns":681759},{"system_id":"van-mobi","hour":20,"departures":456604,"returns":500527},{"system_id":"van-mobi","hour":21,"departures":339409,"returns":379105},{"system_id":"van-mobi","hour":22,"departures":234672,"returns":270474},{"system_id":"van-mobi","hour":23,"departures":155869,"returns":175352}],"hourly_basis":[{"system_id":"mtl-bixi","linked_trips":77345504,"days":2466,"on_hour_grid":45},{"system_id":"tor-bikeshare","linked_trips":37969862,"days":3377,"on_hour_grid":1099},{"system_id":"van-mobi","linked_trips":8811765,"days":3468,"on_hour_grid":8620744}],"yearly":[{"system_id":"mtl-bixi","year":2014,"days":215,"months":8,"abs_net":690572,"linked_trips":3136276,"full_year":false},{"system_id":"mtl-bixi","year":2015,"days":215,"months":8,"abs_net":770100,"linked_trips":3443883,"full_year":true},{"system_id":"mtl-bixi","year":2016,"days":215,"months":8,"abs_net":882656,"linked_trips":4000080,"full_year":true},{"system_id":"mtl-bixi","year":2017,"days":215,"months":8,"abs_net":1029575,"linked_trips":4740357,"full_year":true},{"system_id":"mtl-bixi","year":2018,"days":220,"months":8,"abs_net":1134364,"linked_trips":5277541,"full_year":true},{"system_id":"mtl-bixi","year":2019,"days":201,"months":7,"abs_net":1187569,"linked_trips":5597845,"full_year":true},{"system_id":"mtl-bixi","year":2020,"days":216,"months":8,"abs_net":643312,"linked_trips":3264741,"full_year":true},{"system_id":"mtl-bixi","year":2021,"days":221,"months":8,"abs_net":914187,"linked_trips":5566351,"full_year":true},{"system_id":"mtl-bixi","year":2022,"days":217,"months":8,"abs_net":1332228,"linked_trips":8893889,"full_year":true},{"system_id":"mtl-bixi","year":2023,"days":264,"months":9,"abs_net":1718177,"linked_trips":11719685,"full_year":true},{"system_id":"mtl-bixi","year":2024,"days":366,"months":12,"abs_net":2109044,"linked_trips":13201663,"full_year":true},{"system_id":"mtl-bixi","year":2025,"days":365,"months":12,"abs_net":2308698,"linked_trips":14197540,"full_year":true},{"system_id":"mtl-bixi","year":2026,"days":181,"months":6,"abs_net":879650,"linked_trips":4885892,"full_year":false},{"system_id":"tor-bikeshare","year":2016,"days":184,"months":6,"abs_net":119743,"linked_trips":585225,"full_year":false},{"system_id":"tor-bikeshare","year":2017,"days":365,"months":12,"abs_net":289580,"linked_trips":1492292,"full_year":true},{"system_id":"tor-bikeshare","year":2018,"days":365,"months":12,"abs_net":376113,"linked_trips":1922955,"full_year":true},{"system_id":"tor-bikeshare","year":2019,"days":365,"months":12,"abs_net":458233,"linked_trips":2439063,"full_year":true},{"system_id":"tor-bikeshare","year":2020,"days":366,"months":12,"abs_net":515870,"linked_trips":2909758,"full_year":true},{"system_id":"tor-bikeshare","year":2021,"days":365,"months":12,"abs_net":654043,"linked_trips":3573213,"full_year":true},{"system_id":"tor-bikeshare","year":2022,"days":365,"months":12,"abs_net":742533,"linked_trips":4619190,"full_year":true},{"system_id":"tor-bikeshare","year":2023,"days":365,"months":12,"abs_net":951532,"linked_trips":5710197,"full_year":true},{"system_id":"tor-bikeshare","year":2024,"days":366,"months":12,"abs_net":1047174,"linked_trips":6942161,"full_year":true},{"system_id":"tor-bikeshare","year":2025,"days":365,"months":12,"abs_net":1158283,"linked_trips":7810635,"full_year":true},{"system_id":"tor-bikeshare","year":2026,"days":90,"months":3,"abs_net":134862,"linked_trips":550398,"full_year":false},{"system_id":"van-mobi","year":2017,"days":365,"months":12,"abs_net":175464,"linked_trips":573632,"full_year":true},{"system_id":"van-mobi","year":2018,"days":365,"months":12,"abs_net":218766,"linked_trips":732881,"full_year":true},{"system_id":"van-mobi","year":2019,"days":365,"months":12,"abs_net":259844,"linked_trips":891617,"full_year":true},{"system_id":"van-mobi","year":2020,"days":366,"months":12,"abs_net":187456,"linked_trips":572071,"full_year":true},{"system_id":"van-mobi","year":2021,"days":365,"months":12,"abs_net":215146,"linked_trips":705053,"full_year":true},{"system_id":"van-mobi","year":2022,"days":365,"months":12,"abs_net":259806,"linked_trips":975435,"full_year":true},{"system_id":"van-mobi","year":2023,"days":365,"months":12,"abs_net":332367,"linked_trips":1336357,"full_year":true},{"system_id":"van-mobi","year":2024,"days":366,"months":12,"abs_net":320511,"linked_trips":1300939,"full_year":true},{"system_id":"van-mobi","year":2025,"days":365,"months":12,"abs_net":295759,"linked_trips":1172823,"full_year":true},{"system_id":"van-mobi","year":2026,"days":181,"months":6,"abs_net":139788,"linked_trips":550957,"full_year":false}],"headline_year":2025,"caveat":"A DERIVED LOWER BOUND, not an observed count of rebalancing. It assumes an overnight reset, ignores every move made inside the day, and excludes trips without both ends. Every surface showing it must say so beside the number. Vancouver's is narrower still: Mobi states that trips made by its operations